src/acc/libsmm_acc/libcusmm/parameters.json
[
{"m": 5, "n": 5, "k": 5, "tile_m": 1, "tile_n": 1, "threads": 32, "grouping": 7, "minblocks": 21, "algorithm": "medium", "perf": 429.392, "source": "autotuned"},
{"m": 5, "n": 5, "k": 8, "tile_m": 1, "tile_n": 1, "threads": 32, "grouping": 5, "minblocks": 18, "algorithm": "medium", "perf": 464.773, "source": "autotuned"},
{"m": 5, "n": 8, "k": 5, "tile_m": 3, "tile_n": 1, "threads": 32, "grouping": 10, "minblocks": 8, "algorithm": "medium", "perf": 509.358, "source": "autotuned"},
{"m": 5, "n": 8, "k": 8, "tile_m": 3, "tile_n": 1, "threads": 64, "grouping": 10, "minblocks": 25, "algorithm": "medium", "perf": 596.517, "source": "autotuned"},
{"m": 8, "n": 5, "k": 5, "tile_m": 1, "tile_n": 2, "threads": 32, "grouping": 10, "minblocks": 1, "algorithm": "medium", "perf": 520.297, "source": "autotuned"},
{"m": 8, "n": 5, "k": 8, "tile_m": 1, "tile_n": 2, "threads": 64, "grouping": 10, "minblocks": 25, "algorithm": "medium", "perf": 613.399, "source": "autotuned"},
{"m": 8, "n": 8, "k": 5, "tile_m": 1, "tile_n": 2, "threads": 32, "grouping": 9, "minblocks": 10, "algorithm": "medium", "perf": 757.518, "source": "autotuned"},
{"m": 8, "n": 8, "k": 8, "tile_m": 1, "tile_n": 2, "threads": 32, "grouping": 4, "minblocks": 4, "algorithm": "medium", "perf": 941.471, "source": "autotuned"}
]